{
  "next_check_in": "Review sleep, pain, and completed easy sessions in seven days.",
  "plan_changes": [
    "Reduce this week to two easy sessions and do not catch up missed volume."
  ],
  "preserved_goal": "Keep the half marathon goal and reassess after recovery.",
  "rationale": "The check-in shows reduced availability, poor sleep, and pain; lowering load protects continuity.",
  "recovery_adjustment": "Add rest until sleep improves and calf pain settles.",
  "stop_or_escalate": "Stop for worsening pain and escalate to an appropriate professional."
}
